{"completeness":{"files":"complete","rules":"complete","security":"complete","settings":"complete"},"digest":"sha256:a5a9243db2304b370a052d70ec894998662ce28d32724bfcc9c4451337f49348","files":[],"identity":{"name":"specmint","owner":"opsdevcode"},"kind":"MintRepositorySnapshot","providerKind":"repo.github","redacted":[],"rules":{"allowDeletions":false,"allowForcePushes":false,"pullRequestRequired":false,"requireConversationResolution":false,"requiredApprovingReviewCount":0,"requiredStatusChecks":[]},"schema":"mint.repository-snapshot/v0","security":{"dependencyAlerts":false,"pushProtection":false,"secretScanning":false},"settings":{"allowMergeCommit":true,"allowRebaseMerge":false,"allowSquashMerge":true,"archived":false,"defaultBranch":"main","deleteBranchOnMerge":false,"visibility":"private"},"unavailable":[],"unknown":[],"unsupported":[]}
